{
  "artifact_type": "promotion_judge_audit",
  "audit_id": "pja_example_001",
  "candidate_id": "lic_example_001",
  "layer": "invariant",
  "judge_mode": "model",
  "provider": "openai_responses",
  "model": "gpt-5.2",
  "status": "completed",
  "decision": "narrow",
  "request_hash": "sha256:0000000000000000000000000000000000000000000000000000000000000000",
  "response_hash": "sha256:1111111111111111111111111111111111111111111111111111111111111111",
  "candidate_hash": "sha256:2222222222222222222222222222222222222222222222222222222222222222",
  "deterministic_hash": "sha256:3333333333333333333333333333333333333333333333333333333333333333",
  "request": {
    "model": "gpt-5.2",
    "candidate_id": "lic_example_001"
  },
  "response": {
    "decision": "narrow",
    "rationale": "The candidate needs explicit counterexample exclusions.",
    "narrowed_entry": {
      "title": "Bound daemon MCP promotion to transport migrations",
      "summary": "Apply daemon MCP guidance only when the task is migrating a per-reload stdio server to a healthchecked local HTTP endpoint.",
      "known_breakers": [
        "Counterexample case case_daemon_config_docs_only must remain excluded."
      ]
    }
  },
  "error": null,
  "created_at": "2099-01-01T00:00:00.000Z"
}
